<?xml version="1.0" encoding="UTF-8"?>
<employee xmlns:xsi="http://www.w3.org/2001/XMLSchema-instance"
          xsi:noNamespaceSchemaLocation="Q.no.15.xsd">
    <user>
        <username>reekha88</username>
        <password>Apass123</password>
        <gender>female</gender>
        <post>Admin</post>
        <salary>30000</salary>
        <university>TU</university>
    </user>
</employee>